{
  "$schema": "https://json-schema.org/draft/2020-12/schema",
  "type": "array",
  "items": {
    "type": "object",
    "additionalProperties": false,
    "required": ["name", "title", "description", "category", "format", "path"],
    "properties": {
      "name": { "type": "string", "minLength": 1 },
      "title": { "type": "string", "minLength": 1 },
      "description": { "type": "string", "minLength": 1 },
      "category": { "type": "string", "minLength": 1 },
      "format": { "type": "string", "minLength": 1 },
      "path": { "type": "string", "minLength": 1 }
    }
  }
}
