[
  {
    "name": "Base Prompt",
    "title": "Base Prompt (Non-AI)",
    "description": "Deterministic, repo-scoped guidance without execution.",
    "category": "Core",
    "format": "markdown",
    "path": "src/prompts/index.md"
  },
  {
    "name": "Repo Overview",
    "title": "Repo Overview",
    "description": "Navigate the repo structure and key entry points.",
    "category": "Core",
    "format": "markdown",
    "path": "src/prompts/repo-overview.md"
  },
  {
    "name": "Homepage",
    "title": "Homepage",
    "description": "Guide content, layout, and widget updates.",
    "category": "Frontend",
    "format": "markdown",
    "path": "src/prompts/homepage.md"
  },
  {
    "name": "Spectrum",
    "title": "Spectrum Data",
    "description": "Maintain Spectrum JSON assets and schema consistency.",
    "category": "Data",
    "format": "markdown",
    "path": "src/prompts/spectrum.md"
  },
  {
    "name": "Research",
    "title": "Research Index",
    "description": "Keep research indexes stable and readable.",
    "category": "Data",
    "format": "markdown",
    "path": "src/prompts/research.md"
  },
  {
    "name": "Standards",
    "title": "Standards",
    "description": "Apply repo standards and commit conventions.",
    "category": "Governance",
    "format": "markdown",
    "path": "src/prompts/standards.md"
  }
]
